{
  "corridors": [
    {
      "id": "corridor_01_old_road",
      "kind": "old_road",
      "metadata": {
        "tier": "world"
      },
      "path": [
        [
          0,
          0
        ],
        [
          0,
          1
        ],
        [
          0,
          2
        ],
        [
          1,
          2
        ],
        [
          2,
          2
        ],
        [
          3,
          2
        ]
      ],
      "purpose": "world_spine",
      "sector_count": 6,
      "source": [
        0,
        0
      ],
      "target": [
        3,
        2
      ],
      "visual_material": "road"
    },
    {
      "id": "corridor_02_old_road",
      "kind": "old_road",
      "metadata": {
        "primary_biome": "dark_forest",
        "region_id": 0,
        "tier": "regional"
      },
      "path": [
        [
          2,
          1
        ],
        [
          2,
          2
        ]
      ],
      "purpose": "region_connector",
      "sector_count": 2,
      "source": [
        2,
        1
      ],
      "target": [
        2,
        2
      ],
      "visual_material": "road"
    },
    {
      "id": "corridor_03_old_road",
      "kind": "old_road",
      "metadata": {
        "primary_biome": "ruined_settlement",
        "region_id": 1,
        "tier": "regional"
      },
      "path": [
        [
          5,
          4
        ],
        [
          4,
          4
        ],
        [
          4,
          3
        ],
        [
          3,
          3
        ],
        [
          3,
          2
        ]
      ],
      "purpose": "region_connector",
      "sector_count": 5,
      "source": [
        5,
        4
      ],
      "target": [
        3,
        2
      ],
      "visual_material": "road"
    },
    {
      "id": "corridor_04_pilgrim_route",
      "kind": "pilgrim_route",
      "metadata": {
        "primary_biome": "reformed_chapel",
        "region_id": 2,
        "tier": "regional"
      },
      "path": [
        [
          0,
          4
        ],
        [
          0,
          3
        ],
        [
          0,
          2
        ]
      ],
      "purpose": "region_connector",
      "sector_count": 3,
      "source": [
        0,
        4
      ],
      "target": [
        0,
        2
      ],
      "visual_material": "pilgrim_paving"
    },
    {
      "id": "corridor_05_silt_vein",
      "kind": "silt_vein",
      "metadata": {
        "landmark_id": "regional_02_nanolith_shrine",
        "landmark_kind": "nanolith_shrine",
        "tier": "regional"
      },
      "path": [
        [
          1,
          0
        ],
        [
          0,
          0
        ]
      ],
      "purpose": "landmark_spur",
      "sector_count": 2,
      "source": [
        1,
        0
      ],
      "target": [
        0,
        0
      ],
      "visual_material": "silt_trace"
    },
    {
      "id": "corridor_06_silt_vein",
      "kind": "silt_vein",
      "metadata": {
        "landmark_id": "regional_03_nanolith_shrine",
        "landmark_kind": "nanolith_shrine",
        "tier": "regional"
      },
      "path": [
        [
          5,
          0
        ],
        [
          4,
          0
        ],
        [
          3,
          0
        ],
        [
          2,
          0
        ],
        [
          1,
          0
        ]
      ],
      "purpose": "landmark_spur",
      "sector_count": 5,
      "source": [
        5,
        0
      ],
      "target": [
        1,
        0
      ],
      "visual_material": "silt_trace"
    },
    {
      "id": "corridor_07_silt_vein",
      "kind": "silt_vein",
      "metadata": {
        "landmark_id": "regional_05_nanolith_shrine",
        "landmark_kind": "nanolith_shrine",
        "tier": "regional"
      },
      "path": [
        [
          2,
          3
        ],
        [
          2,
          2
        ]
      ],
      "purpose": "landmark_spur",
      "sector_count": 2,
      "source": [
        2,
        3
      ],
      "target": [
        2,
        2
      ],
      "visual_material": "silt_trace"
    }
  ],
  "local_realization": [
    {
      "anchors": [
        {
          "coord": 9,
          "edge": "S",
          "to": [
            0,
            1
          ],
          "x": 9,
          "y": 14
        }
      ],
      "corridor_id": "corridor_01_old_road",
      "kind": "old_road",
      "path_index": 0,
      "purpose": "world_spine",
      "route_cells": [
        [
          9,
          14
        ],
        [
          8,
          14
        ],
        [
          7,
          14
        ],
        [
          6,
          14
        ],
        [
          5,
          14
        ],
        [
          4,
          14
        ],
        [
          3,
          14
        ],
        [
          2,
          14
        ],
        [
          2,
          13
        ],
        [
          2,
          12
        ]
      ],
      "sector": [
        0,
        0
      ],
      "visual_material": "road"
    },
    {
      "anchors": [
        {
          "coord": 9,
          "edge": "N",
          "to": [
            0,
            0
          ],
          "x": 9,
          "y": 0
        },
        {
          "coord": 14,
          "edge": "S",
          "to": [
            0,
            2
          ],
          "x": 14,
          "y": 14
        }
      ],
      "corridor_id": "corridor_01_old_road",
      "kind": "old_road",
      "path_index": 1,
      "purpose": "world_spine",
      "route_cells": [
        [
          9,
          0
        ],
        [
          10,
          0
        ],
        [
          11,
          0
        ],
        [
          12,
          0
        ],
        [
          13,
          0
        ],
        [
          13,
          1
        ],
        [
          13,
          2
        ],
        [
          14,
          2
        ],
        [
          14,
          3
        ],
        [
          14,
          4
        ],
        [
          14,
          5
        ],
        [
          14,
          6
        ],
        [
          14,
          7
        ],
        [
          14,
          8
        ],
        [
          14,
          9
        ],
        [
          14,
          10
        ],
        [
          14,
          11
        ],
        [
          14,
          12
        ],
        [
          14,
          13
        ],
        [
          14,
          14
        ]
      ],
      "sector": [
        0,
        1
      ],
      "visual_material": "road"
    },
    {
      "anchors": [
        {
          "coord": 14,
          "edge": "N",
          "to": [
            0,
            1
          ],
          "x": 14,
          "y": 0
        },
        {
          "coord": 11,
          "edge": "E",
          "to": [
            1,
            2
          ],
          "x": 19,
          "y": 11
        }
      ],
      "corridor_id": "corridor_01_old_road",
      "kind": "old_road",
      "path_index": 2,
      "purpose": "world_spine",
      "route_cells": [
        [
          14,
          0
        ],
        [
          15,
          0
        ],
        [
          16,
          0
        ],
        [
          17,
          0
        ],
        [
          18,
          0
        ],
        [
          19,
          0
        ],
        [
          19,
          1
        ],
        [
          19,
          2
        ],
        [
          19,
          3
        ],
        [
          19,
          4
        ],
        [
          19,
          5
        ],
        [
          19,
          6
        ],
        [
          19,
          7
        ],
        [
          19,
          8
        ],
        [
          19,
          9
        ],
        [
          19,
          10
        ],
        [
          19,
          11
        ]
      ],
      "sector": [
        0,
        2
      ],
      "visual_material": "road"
    },
    {
      "anchors": [
        {
          "coord": 11,
          "edge": "W",
          "to": [
            0,
            2
          ],
          "x": 0,
          "y": 11
        },
        {
          "coord": 11,
          "edge": "E",
          "to": [
            2,
            2
          ],
          "x": 19,
          "y": 11
        }
      ],
      "corridor_id": "corridor_01_old_road",
      "kind": "old_road",
      "path_index": 3,
      "purpose": "world_spine",
      "route_cells": [
        [
          0,
          11
        ],
        [
          1,
          11
        ],
        [
          2,
          11
        ],
        [
          3,
          11
        ],
        [
          4,
          11
        ],
        [
          5,
          11
        ],
        [
          6,
          11
        ],
        [
          7,
          11
        ],
        [
          8,
          11
        ],
        [
          9,
          11
        ],
        [
          10,
          11
        ],
        [
          10,
          10
        ],
        [
          11,
          10
        ],
        [
          12,
          10
        ],
        [
          13,
          10
        ],
        [
          14,
          10
        ],
        [
          15,
          10
        ],
        [
          16,
          10
        ],
        [
          17,
          10
        ],
        [
          18,
          10
        ],
        [
          19,
          10
        ],
        [
          19,
          11
        ]
      ],
      "sector": [
        1,
        2
      ],
      "visual_material": "road"
    },
    {
      "anchors": [
        {
          "coord": 11,
          "edge": "W",
          "to": [
            1,
            2
          ],
          "x": 0,
          "y": 11
        },
        {
          "coord": 11,
          "edge": "E",
          "to": [
            3,
            2
          ],
          "x": 19,
          "y": 11
        }